12,https://x.wuxoo4.com/mp4/b71ec524fd40ea51b24e8827022d3868.mp4,性感闺蜜两个在豪宅客厅互相抚摸舔弄然后在沙发上摩擦自慰
18,https://x.wuxoo4.com/mp4/4a95ec624ae921b41d78cbc5a5b6723f.mp4,1Pondo-010219_001成功约到老婆的好身材闺蜜 第一次干还有点紧张
49,https://x.wuxoo4.com/mp4/05d1c0980a9df6fa1912ad789401a4e8.mp4,震撼直播-性感网红美女在闺蜜结婚前一晚在酒店婚房一起和她前男友激情3P,这次操完以后就不能随便干了
80,https://x.wuxoo4.com/mp4/1699146d80145e5415970787fc93d2d1.mp4,性感闺蜜两个在厨房勾引巨屌大叔然后被拉到床上猛烈的性交
84,https://x.wuxoo4.com/mp4/0a7a7e3f194a873347b697b48ae99795.mp4,闺蜜两人在卧室穿着情趣内衣丝袜互舔自慰最终双双都达到高潮
85,https://x.wuxoo4.com/mp4/a4608a4d78afdb0b02b54f74595e9005.mp4,HD-pppd-682和女友巨乳闺蜜大胆在客厅激情暧昧 女友回来了还坚持插入小穴吸吮咬舐著湿润的穴肉 HD-pppd-682
88,https://x.wuxoo4.com/mp4/ae76067c78dff9116d86e81e43b3da0a.mp4,HD-pppd-682出轨男友和我巨乳闺蜜搞上了 在楼梯上暧昧激情女上位姿用劲吸吮咬舐著湿润的穴肉
88,https://x.wuxoo4.com/mp4/77005f54b42f06b5f3df8a87d45e7fed.mp4,性感美女买丝袜去巨乳闺蜜家和她在卧室互相舔对方小骚穴
89,https://x.wuxoo4.com/mp4/3f1ae39ae7e3028a785896681dd0f336.mp4,ssni-536 表妹可爱闺蜜和我在走廊上甜蜜性交 抚摸粉嫩的美乳女上位姿势肉棒不停的磨蹭着
99,https://x.wuxoo4.com/mp4/c3df5317dc5417c303c9650fd9550107.mp4,闺蜜里的穿上性感丝袜在豪宅客厅沙发使用一个道具插入两人小穴
102,https://x.wuxoo4.com/mp4/3c47273ba9e4e1a8a0b6dac09ce30f54.mp4,到闺蜜出租房里住的清纯美女被闺蜜男友强行侵犯 舔逼湿哒哒的肉穴妥协口交粗壮肉棒 ipx-321
114,https://x.wuxoo4.com/mp4/70035ee29929612dc25042b5c87cbb00.mp4,ebod-706 到清纯学妹的豪宅家里做客 趁着俩闺蜜做饭和学长激情在客厅沙发上做爱 下面已经湿润的一塌糊涂
116,https://x.wuxoo4.com/mp4/1edc07f38b3c55cbeb2823ef12fafb8c.mp4,同性恋黑人妹子和纹身闺蜜野外树林车上激情时刻
127,https://x.wuxoo4.com/mp4/ba169ddd850f6db5a32bbaa9f2be98e0.mp4,就要开学了性感美女月儿公路边车上露三点抠穴自慰勾引闺蜜老公摸她丰满的奶子和淫穴
138,https://x.wuxoo4.com/mp4/3f248121eda908cf3ac96ddbf7111ec8.mp4,FC2PPV-1022385 在出租房里和清纯美女闺蜜相约共享男友 三个人激情的性交 粗壮的肉棒轮操骚穴
142,https://x.wuxoo4.com/mp4/1edc07f38b3c55cbeb2823ef12fafb8c.mp4,黑人妹子和纹身闺蜜野外树林车上玩同性恋
142,https://x.wuxoo4.com/mp4/194df7ea329238cd991d9937561e764c.mp4,闺蜜两人在豪宅客厅和两黑人兄弟玩女上位群P
144,https://x.wuxoo4.com/mp4/5dd8305ace6de599dc7e9c34ec2d2082.mp4,闺蜜两去教授家竟然用身体勾引和她们玩双飞
148,https://x.wuxoo4.com/mp4/c3a5e0fb432eed74928fa560d6221830.mp4,少妇和闺蜜在酒店沙发上用道具玩百合
149,https://x.wuxoo4.com/mp4/3ed92a19ab580deb023f832499876511.mp4,浴室里不忘激情一翻被闺蜜偷拍者真开放的年轻人
151,https://x.wuxoo4.com/mp4/7ec1d3134677cded563e5b6cebcf4231.mp4,两巨乳少妇闺蜜和中年大叔在卧室玩双飞
156,https://x.wuxoo4.com/mp4/ff90f7e68f068b4aa19bca6d756bc86c.mp4,当我的女朋友不在家的时候我和她闺蜜玩练晨
162,https://x.wuxoo4.com/mp4/93095ef1f4da2bcf762c09244c739809.mp4,超强推荐 极品闺蜜vs高颜值高富帅兄弟
166,https://x.wuxoo4.com/mp4/d4a3b7f88cd56736e170459da25ebd37.mp4,3P在房间里屌的两个闺蜜 玩着逼做着爱 操的还是蛮舒服的
170,https://x.wuxoo4.com/mp4/8804c47b59e2dca62581a16f2b255f93.mp4,女朋友叫上她的巨闺蜜一起玩3还有这种操作
184,https://x.wuxoo4.com/mp4/8b121a0831ecef10d1f3100660629d62.mp4,带着闺蜜一起玩起来群交诱惑的女仆制服装搞的我都硬起来了
190,https://x.wuxoo4.com/mp4/88709a2ba2d52c9db277c54ef537f97f.mp4,与好闺蜜共享我的男朋友
191,https://x.wuxoo4.com/mp4/f891f5092e8892d3f6d310c256967d6a.mp4,短发御姐用身体勾引闺蜜男友
191,https://x.wuxoo4.com/mp4/0513ce3b44c1f41c28433db17540bbf6.mp4,美女在家和俩男闺蜜玩3p
193,https://x.wuxoo4.com/mp4/5f0eb7865197d24f98d86e0f63c2380a.mp4,少妇去闺蜜糟闺蜜老公调戏
195,https://x.wuxoo4.com/mp4/436054744b7e5c40be211263a72f4123.mp4,兔儿装女郎约闺蜜一起玩群交
196,https://x.wuxoo4.com/mp4/48e33d3b17257ac6ad57427e156117ec.mp4,和闺蜜去旅游糟闺蜜老公强奸
200,https://x.wuxoo4.com/mp4/d7e0ecf14170329386b725f21bccc9dd.mp4,开放老外直接在大路上和极品两闺蜜大胆开干
201,https://x.wuxoo4.com/mp4/2d245e4cef26676283fabf701e7dea38.mp4,和闺蜜老公在客厅做爱闺蜜突然回来
208,https://x.wuxoo4.com/mp4/d9904427bd29426d118911e5ba9ae572.mp4,和闺蜜男友偷情
220,https://x.wuxoo4.com/mp4/697c2455fb33d01b43b86b7cd1a8fff5.mp4,有几个女闺蜜何尝不好
232,https://x.wuxoo4.com/mp4/e003f4316368d8758a39a32183e49d7c.mp4,二嫂和闺蜜3龙2凤5P大战真担心二嫂这单薄的身子骨受不了对白清晰
240,https://x.wuxoo4.com/mp4/566a75e374de834565c0e736a59f7cb0.mp4,土豪金大哥和老婆闺蜜酒店开房真假香蕉轮流吃
266,https://x.wuxoo4.com/mp4/4261b8f287982d39a87c7e29289d10ad.mp4,俩闺蜜约一男子来家里做客屌的很激情内射一脸
268,https://x.wuxoo4.com/mp4/c93b52624882de7e43e66f8717fba921.mp4,闺蜜在洗澡 男友就冲进浴室内拿起肉棒就往闺蜜嘴里操
272,https://x.wuxoo4.com/mp4/4fa142625833e8406c0ac7b024bcdce6.mp4,把女友闺蜜灌醉后开操
278,https://x.wuxoo4.com/mp4/93ff2f32656d5a5605f23d1b0308581f.mp4,勾引男闺蜜啪啪大秀 口交做爱
281,https://x.wuxoo4.com/mp4/04ec0e6621af3fef7faa20fbaf46db9d.mp4,闺蜜俩被俩大屌带到小木屋内猛干小淫穴
281,https://x.wuxoo4.com/mp4/989537c6b1a974a1990df58d79f0b7f6.mp4,闺蜜带头叫几个大屌操朋友的淫穴
287,https://x.wuxoo4.com/mp4/0675811338722717797bcf9b92ddbc04.mp4,在闺蜜家中被哥哥用大肉棒操淫女的小淫穴
292,https://x.wuxoo4.com/mp4/2d97497978b910ac7680822b53d18e3d.mp4,正在休息的女友闺蜜给啪啪了很刺激
292,https://x.wuxoo4.com/mp4/9a68e461b1eba54ad8a05af9edc5e988.mp4,约操妹妹可爱的闺蜜宾馆干一炮
304,https://x.wuxoo4.com/mp4/fa11bc5a460ff62d36c54af2280e4af3.mp4,疯狂4P大乱战性感黑丝性女携肉肉闺蜜激情大战2猛男
314,https://x.wuxoo4.com/mp4/a4fa902c25eda01734b93e9852982127.mp4,19岁超嫩校花美女偷偷和闺蜜的男友到宾馆偷情 超嫩超紧
309,https://x.wuxoo4.com/mp4/985fd223b13cbdcb794d265398bd7b03.mp4,找个男闺蜜拍淫荡的视频
336,https://x.wuxoo4.com/mp4/f9453eb66dd92475cc71a9c404366748.mp4,老婆闺蜜来家玩被我上
342,https://x.wuxoo4.com/mp4/f21ffe05e19b706ef5758eff6e9bc147.mp4,周日在家跟男朋友享受二人世界 闺蜜刚好也来了 就一起 3P搞起
345,https://x.wuxoo4.com/mp4/b03857b11e6ecb65ea3de789f6549393.mp4,干完女朋友再干他闺蜜
352,https://x.wuxoo4.com/mp4/86d20baddbb2f912daf7e9ae067da77c.mp4,姐姐和闺蜜一起为我服务
355,https://x.wuxoo4.com/mp4/76fb388d7e85d02d94a0548f69644dda.mp4,三人行3p 大战一根肉棍屌骚货和她的闺蜜 干的很嗨
365,https://x.wuxoo4.com/mp4/50e0088c74ab8f49a882de7c9f0720e5.mp4,闺蜜支走后啪啪草到妹子表情销魂
382,https://x.wuxoo4.com/mp4/b4fad1e937fe12ea558d23006d79bf98.mp4,真想约她的闺蜜一起3P
377,https://x.wuxoo4.com/mp4/113158bff9e77b59aa8f7e3e68499848.mp4,跟自己的闺蜜分享大鸡巴屌王老公
410,https://x.wuxoo4.com/mp4/b8962e7fffc09aa337d4657967b941db.mp4,女友的闺蜜正好在家 经不住诱惑
419,https://x.wuxoo4.com/mp4/48b0d9d6f56bd7b0ceeb3c21759305cd.mp4,闺蜜在家中用道具自慰
465,https://x.wuxoo4.com/mp4/d8980be4f6316b8670778a904a00f1bc.mp4,网红主播小妹和闺蜜大冷天开着暖灯
479,https://x.wuxoo4.com/mp4/4dbeafc197b068823c2a62978e9f2c74.mp4,老婆闺蜜和男友吵架后约老婆一起到宾馆开房倾述,趁老婆睡着在床上偷偷干了她闺蜜！冲刺时差点被发现！
